{
  "bodyTypeName": "male",
  "url": "https://sanderfrenken.github.io/Universal-LPC-Spritesheet-Character-Generator/#?body=Body_color_light&head=Human_male_light&weapon=Normal_light&hat=Cloth_hood_brown&vest=Vest_green&legs=Pants_forest&bracers=none&gloves=Gloves_walnut&clothes=none&shoes=Shoes_leather&ammo=Ammo_arrow&quiver=Quiver_quiver",
  "spritesheets": "https://sanderfrenken.github.io/Universal-LPC-Spritesheet-Character-Generator/spritesheets/",
  "version": 1,
  "datetime": "9/20/2024, 3:27:14 PM",
  "credits": "Authors: bluecarrot16, Benjamin K. Smith (BenCreating), Evert, Eliza Wyatt (ElizaWy), TheraHedwig, MuffinElZangano, Durrani, Johannes Sj?lund (wulax), Stephen Challener (Redshrike), Johannes Sjölund (wulax), Michael Whitlock (bigbeargames), Matthew Krohn (makrohn), Thane Brimhall (pennomi), laetissima, JaidynReiman, Joe White, Pierre Vigier (pvigier)\n\n- body/bodies/male/light.png: by bluecarrot16, Benjamin K. Smith (BenCreating), Evert, Eliza Wyatt (ElizaWy), TheraHedwig, MuffinElZangano, Durrani, Johannes Sj?lund (wulax), Stephen Challener (Redshrike). License(s): CC-BY-SA 3.0, GPL 3.0. see details at https://opengameart.org/content/lpc-character-bases; 'Thick' Male Revised Run/Climb by JaidynReiman (based on ElizaWy's LPC Revised)\n    - https://opengameart.org/content/liberated-pixel-cup-lpc-base-assets-sprites-map-tiles\n    - https://opengameart.org/content/lpc-medieval-fantasy-character-sprites\n    - https://opengameart.org/content/lpc-male-jumping-animation-by-durrani\n    - https://opengameart.org/content/lpc-runcycle-and-diagonal-walkcycle\n    - https://opengameart.org/content/lpc-revised-character-basics\n\n- head/heads/human/male/light.png: by bluecarrot16, Benjamin K. Smith (BenCreating), Stephen Challener (Redshrike). License(s): OGA-BY 3.0, CC-BY-SA 3.0, GPL 3.0. original head by Redshrike; tweaks by BenCreating; modular version by bluecarrot16\n    - https://opengameart.org/content/liberated-pixel-cup-lpc-base-assets-sprites-map-tiles\n    - https://opengameart.org/content/lpc-character-bases\n\n- hat/cloth/male/hood_brown.png: by Johannes Sjölund (wulax). License(s): OGA-BY 3.0, CC-BY-SA 3.0, GPL 3.0. \n    - https://opengameart.org/content/lpc-medieval-fantasy-character-sprites\n\n- gloves/male/walnut.png: by Michael Whitlock (bigbeargames), Matthew Krohn (makrohn), Johannes Sjölund (wulax), bluecarrot16. License(s): OGA-BY 3.0, CC-BY-SA 3.0, GPL 3.0. \n    - https://opengameart.org/content/lpc-medieval-fantasy-character-sprites\n    - http://opengameart.org/content/lpc-clothing-updates\n\n- torso/clothes/vest/male/green.png: by bluecarrot16, Thane Brimhall (pennomi), laetissima. License(s): CC-BY-SA 3.0, GPL 3.0. \n    - https://opengameart.org/content/lpc-2-characters\n    - https://opengameart.org/content/lpc-gentleman\n\n- quiver/quiver.png: by Johannes Sjölund (wulax). License(s): CC-BY-SA 3.0, GPL 3.0. \n    - https://opengameart.org/content/lpc-medieval-fantasy-character-sprites\n\n- legs/pants/male/forest.png: by bluecarrot16, JaidynReiman, Joe White, Matthew Krohn (makrohn), Johannes Sjölund (wulax). License(s): CC-BY-SA 3.0, GPL 3.0. \n    - https://opengameart.org/content/liberated-pixel-cup-lpc-base-assets-sprites-map-tiles\n    - https://opengameart.org/content/lpc-medieval-fantasy-character-sprites\n\n- feet/shoes/male/leather.png: by bluecarrot16, Johannes Sjölund (wulax). License(s): OGA-BY 3.0, CC-BY-SA 3.0, GPL 3.0. \n    - https://opengameart.org/content/lpc-medieval-fantasy-character-sprites\n    - http://opengameart.org/content/lpc-clothing-updates\n\n- weapon/ranged/bow/arrow/arrow.png: by Johannes Sjölund (wulax). License(s): CC-BY-SA 3.0, GPL 3.0. \n    - https://opengameart.org/content/lpc-medieval-fantasy-character-sprites\n\n- weapon/ranged/bow/normal/universal/background/light.png: by Johannes Sjölund (wulax), Pierre Vigier (pvigier). License(s): OGA-BY 3.0+, GPL 3.0, CC-BY 4.0. \n    - https://opengameart.org/content/lpc-medieval-fantasy-character-sprites\n    - https://opengameart.org/content/lpc-walk-animations-for-bows\n\n- weapon/ranged/bow/normal/universal/foreground/light.png: by Johannes Sjölund (wulax), Pierre Vigier (pvigier). License(s): OGA-BY 3.0+, GPL 3.0, CC-BY 4.0. \n    - https://opengameart.org/content/lpc-medieval-fantasy-character-sprites\n    - https://opengameart.org/content/lpc-walk-animations-for-bows\n\n- weapon/ranged/bow/normal/walk/background/light.png: by Johannes Sjölund (wulax), Pierre Vigier (pvigier). License(s): OGA-BY 3.0+, GPL 3.0, CC-BY 4.0. \n    - https://opengameart.org/content/lpc-medieval-fantasy-character-sprites\n    - https://opengameart.org/content/lpc-walk-animations-for-bows\n\n- weapon/ranged/bow/normal/walk/foreground/light.png: by Johannes Sjölund (wulax), Pierre Vigier (pvigier). License(s): OGA-BY 3.0+, GPL 3.0, CC-BY 4.0. \n    - https://opengameart.org/content/lpc-medieval-fantasy-character-sprites\n    - https://opengameart.org/content/lpc-walk-animations-for-bows",
  "layers": [
    {
      "fileName": "weapon/ranged/bow/normal/universal/background/light.png",
      "zPos": -1,
      "parentName": "weapon",
      "name": "Normal",
      "variant": "light"
    },
    {
      "fileName": "weapon/ranged/bow/normal/walk/background/light.png",
      "zPos": -1,
      "custom_animation": "walk_128",
      "parentName": "weapon",
      "name": "Normal",
      "variant": "light"
    },
    {
      "fileName": "quiver/quiver.png",
      "zPos": 8,
      "parentName": "quiver",
      "name": "Quiver",
      "variant": "quiver"
    },
    {
      "fileName": "body/bodies/male/light.png",
      "zPos": 10,
      "parentName": "body",
      "name": "Body color",
      "variant": "light"
    },
    {
      "fileName": "feet/shoes/male/leather.png",
      "zPos": 15,
      "parentName": "shoes",
      "name": "Shoes",
      "variant": "leather"
    },
    {
      "fileName": "legs/pants/male/forest.png",
      "zPos": 20,
      "parentName": "legs",
      "name": "Pants",
      "variant": "forest"
    },
    {
      "fileName": "torso/clothes/vest/male/green.png",
      "zPos": 45,
      "parentName": "vest",
      "name": "Vest",
      "variant": "green"
    },
    {
      "fileName": "gloves/male/walnut.png",
      "zPos": 70,
      "parentName": "gloves",
      "name": "Gloves",
      "variant": "walnut"
    },
    {
      "fileName": "head/heads/human/male/light.png",
      "zPos": 100,
      "parentName": "head",
      "name": "Human male",
      "variant": "light"
    },
    {
      "fileName": "hat/cloth/male/hood_brown.png",
      "zPos": 130,
      "parentName": "hat",
      "name": "Cloth",
      "variant": "hood brown"
    },
    {
      "fileName": "weapon/ranged/bow/normal/universal/foreground/light.png",
      "zPos": 140,
      "parentName": "weapon",
      "name": "Normal",
      "variant": "light"
    },
    {
      "fileName": "weapon/ranged/bow/normal/walk/foreground/light.png",
      "zPos": 141,
      "custom_animation": "walk_128",
      "parentName": "weapon",
      "name": "Normal",
      "variant": "light"
    },
    {
      "fileName": "weapon/ranged/bow/arrow/arrow.png",
      "zPos": 150,
      "parentName": "ammo",
      "name": "Ammo",
      "variant": "arrow"
    }
  ]
}