{
    "bodyTypeName": "male",
    "url": "https://sanderfrenken.github.io/Universal-LPC-Spritesheet-Character-Generator/#?body=Body_color_amber&head=Human_male_amber&shield=Shield_round_brown&clothes=none&vest=none&sex=male&legs=Pants_blue&beard=5_O'clock_Shadow_black&eyebrows=none&eyes=Eyes_brown&shoes=Sandals_leather&bandana=none&headcover=none&hat=none&hair=High_and_tight_blonde&armour=Leather_bluegray",
    "spritesheets": "https://sanderfrenken.github.io/Universal-LPC-Spritesheet-Character-Generator/spritesheets/",
    "version": 1,
    "datetime": "9/12/2024, 4:43:14 PM",
    "credits": "Authors: bluecarrot16, Benjamin K. Smith (BenCreating), Evert, Eliza Wyatt (ElizaWy), TheraHedwig, MuffinElZangano, Durrani, Johannes Sj?lund (wulax), Stephen Challener (Redshrike), JaidynReiman, Matthew Krohn (makrohn), Thane Brimhall (pennomi), Skorpio, Johannes Sjölund (wulax), Joe White, Nila122\n\n- body/bodies/male/amber.png: by bluecarrot16, Benjamin K. Smith (BenCreating), Evert, Eliza Wyatt (ElizaWy), TheraHedwig, MuffinElZangano, Durrani, Johannes Sj?lund (wulax), Stephen Challener (Redshrike). License(s): CC-BY-SA 3.0, GPL 3.0. see details at https://opengameart.org/content/lpc-character-bases; 'Thick' Male Revised Run/Climb by JaidynReiman (based on ElizaWy's LPC Revised)\n    - https://opengameart.org/content/liberated-pixel-cup-lpc-base-assets-sprites-map-tiles\n    - https://opengameart.org/content/lpc-medieval-fantasy-character-sprites\n    - https://opengameart.org/content/lpc-male-jumping-animation-by-durrani\n    - https://opengameart.org/content/lpc-runcycle-and-diagonal-walkcycle\n    - https://opengameart.org/content/lpc-revised-character-basics\n\n- head/heads/human/male/amber.png: by bluecarrot16, Benjamin K. Smith (BenCreating), Stephen Challener (Redshrike). License(s): OGA-BY 3.0, CC-BY-SA 3.0, GPL 3.0. original head by Redshrike; tweaks by BenCreating; modular version by bluecarrot16\n    - https://opengameart.org/content/liberated-pixel-cup-lpc-base-assets-sprites-map-tiles\n    - https://opengameart.org/content/lpc-character-bases\n\n- eyes/human/adult/brown.png: by JaidynReiman, Matthew Krohn (makrohn), Stephen Challener (Redshrike). License(s): OGA-BY 3.0, CC-BY-SA 3.0, GPL 3.0. original by Redshrike, mapped to all frames by Matthew Krohn & JaidynReiman\n    - https://opengameart.org/content/liberated-pixel-cup-lpc-base-assets-sprites-map-tiles\n\n- beards/beard/5oclock_shadow/black.png: by JaidynReiman, Thane Brimhall (pennomi). License(s): CC-BY-SA 3.0, GPL 3.0. Original by Pennomi, repositioning by JaidynReiman.\n    - https://opengameart.org/content/lpc-base-character-expressions\n\n- hair/high_and_tight/male/blonde.png: by Skorpio, bluecarrot16. License(s): CC-BY-SA 3.0, GPL 3.0. \n    - https://opengameart.org/content/lpc-skorpios-scifi-sprite-pack\n    - https://opengameart.org/content/lpc-hair\n\n- torso/armour/leather/male/bluegray.png: by Johannes Sjölund (wulax). License(s): CC-BY-SA 3.0, GPL 3.0. \n    - https://opengameart.org/content/lpc-medieval-fantasy-character-sprites\n    - http://opengameart.org/content/lpc-clothing-updates\n\n- legs/pants/male/blue.png: by bluecarrot16, JaidynReiman, Joe White, Matthew Krohn (makrohn), Johannes Sjölund (wulax). License(s): CC-BY-SA 3.0, GPL 3.0. \n    - https://opengameart.org/content/liberated-pixel-cup-lpc-base-assets-sprites-map-tiles\n    - https://opengameart.org/content/lpc-medieval-fantasy-character-sprites\n\n- feet/sandals/male/leather.png: by Nila122, JaidynReiman, Matthew Krohn (makrohn), Johannes Sjölund (wulax). License(s): OGA-BY 3.0, CC-BY-SA 3.0, GPL 2.0, GPL 3.0. \n    - https://opengameart.org/content/lpc-roman-armor\n\n- shield/male/round_brown.png: by Johannes Sjölund (wulax). License(s): CC-BY-SA 3.0, GPL 3.0. \n    - https://opengameart.org/content/lpc-medieval-fantasy-character-sprites",
    "layers": [
      {
        "fileName": "body/bodies/male/amber.png",
        "zPos": 10,
        "parentName": "body",
        "name": "Body color",
        "variant": "amber"
      },
      {
        "fileName": "feet/sandals/male/leather.png",
        "zPos": 15,
        "parentName": "shoes",
        "name": "Sandals",
        "variant": "leather"
      },
      {
        "fileName": "legs/pants/male/blue.png",
        "zPos": 20,
        "parentName": "legs",
        "name": "Pants",
        "variant": "blue"
      },
      {
        "fileName": "torso/armour/leather/male/bluegray.png",
        "zPos": 60,
        "parentName": "armour",
        "name": "Leather",
        "variant": "bluegray"
      },
      {
        "fileName": "head/heads/human/male/amber.png",
        "zPos": 100,
        "parentName": "head",
        "name": "Human male",
        "variant": "amber"
      },
      {
        "fileName": "eyes/human/adult/brown.png",
        "zPos": 105,
        "parentName": "eyes",
        "name": "Eyes",
        "variant": "brown"
      },
      {
        "fileName": "shield/male/round_brown.png",
        "zPos": 110,
        "parentName": "shield",
        "name": "Shield",
        "variant": "round brown"
      },
      {
        "fileName": "beards/beard/5oclock_shadow/black.png",
        "zPos": 111,
        "parentName": "beard",
        "name": "5 O'clock Shadow",
        "variant": "black"
      },
      {
        "fileName": "hair/high_and_tight/male/blonde.png",
        "zPos": 120,
        "parentName": "hair",
        "name": "High and tight",
        "variant": "blonde"
      }
    ]
  }