{
    "bodyTypeName": "male",
    "url": "https://sanderfrenken.github.io/Universal-LPC-Spritesheet-Character-Generator/#?body=Body_color_light&head=Human_male_light&weapon=Slingshot_slingshot&wound_mouth=none&wound_eye=none&wound_arm=none&facial_mask=none&headcover=none&hat=Cloth_bandana_red&eyes=Eyes_gray&clothes=Sleeveless_striped_tan&legs=Pantaloons_sky&shoes=Shoes_leather&belt=Belly_belt_tan",
    "spritesheets": "https://sanderfrenken.github.io/Universal-LPC-Spritesheet-Character-Generator/spritesheets/",
    "version": 1,
    "datetime": "9/8/2024, 3:48:03 PM",
    "credits": "Authors: bluecarrot16, Benjamin K. Smith (BenCreating), Evert, Eliza Wyatt (ElizaWy), TheraHedwig, MuffinElZangano, Durrani, Johannes Sj?lund (wulax), Stephen Challener (Redshrike), Mark Weyer, Johannes Sjölund (wulax), Matthew Krohn (makrohn), JaidynReiman, Marcel van de Steeg (MadMarcel), Nila122\n\n- body/bodies/male/light.png: by bluecarrot16, Benjamin K. Smith (BenCreating), Evert, Eliza Wyatt (ElizaWy), TheraHedwig, MuffinElZangano, Durrani, Johannes Sj?lund (wulax), Stephen Challener (Redshrike). License(s): CC-BY-SA 3.0, GPL 3.0. see details at https://opengameart.org/content/lpc-character-bases; 'Thick' Male Revised Run/Climb by JaidynReiman (based on ElizaWy's LPC Revised)\n    - https://opengameart.org/content/liberated-pixel-cup-lpc-base-assets-sprites-map-tiles\n    - https://opengameart.org/content/lpc-medieval-fantasy-character-sprites\n    - https://opengameart.org/content/lpc-male-jumping-animation-by-durrani\n    - https://opengameart.org/content/lpc-runcycle-and-diagonal-walkcycle\n    - https://opengameart.org/content/lpc-revised-character-basics\n\n- head/heads/human/male/light.png: by bluecarrot16, Benjamin K. Smith (BenCreating), Stephen Challener (Redshrike). License(s): OGA-BY 3.0, CC-BY-SA 3.0, GPL 3.0. original head by Redshrike; tweaks by BenCreating; modular version by bluecarrot16\n    - https://opengameart.org/content/liberated-pixel-cup-lpc-base-assets-sprites-map-tiles\n    - https://opengameart.org/content/lpc-character-bases\n\n- eyes/human/adult/gray.png: by Mark Weyer, Johannes Sjölund (wulax), Matthew Krohn (makrohn), Stephen Challener (Redshrike). License(s): OGA-BY 3.0, CC-BY-SA 3.0, GPL 3.0. original by Redshrike, color by Mark Weyer & Wulax, mapped to all frames by Matthew Krohn & JaidynReiman\n    - https://opengameart.org/content/liberated-pixel-cup-lpc-base-assets-sprites-map-tiles\n    - https://opengameart.org/content/lpc-medieval-fantasy-character-sprites\n\n- hat/cloth/male/bandana_red.png: by Matthew Krohn (makrohn), JaidynReiman, Marcel van de Steeg (MadMarcel). License(s): OGA-BY 3.0, CC-BY-SA 3.0. \n    - https://opengameart.org/content/lpc-female-orcogregoblintroll-base-walkcycle\n    - https://github.com/makrohn/Universal-LPC-spritesheet/commit/f50007cb47c235d8896cafae7a613f0b6a9a09a8?short_path=02b86d4#diff-02b86d45789a3e3e8e79519c7d17d15c9e6ecc9b4ddecb1bcd8dfbbaef430b75\n\n- torso/clothes/sleeveless/striped/male/tan.png: by bluecarrot16, Matthew Krohn (makrohn), JaidynReiman, Marcel van de Steeg (MadMarcel), Nila122, Johannes Sjölund (wulax), Stephen Challener (Redshrike). License(s): CC-BY-SA 3.0. \n    - https://opengameart.org/content/lpc-female-orcogregoblintroll-base-walkcycle\n    - https://opengameart.org/content/lpc-curly-hair-elven-ears-white-cape-with-blue-trim-and-more\n    - https://opengameart.org/content/more-lpc-clothes-and-hair\n    - https://opengameart.org/content/lpc-pirates\n\n- torso/waist/belt_belly/male/tan.png: by bluecarrot16, Johannes Sjölund (wulax), Matthew Krohn (makrohn). License(s): CC-BY-SA 3.0, GPL 3.0. \n    - https://opengameart.org/content/lpc-combat-armor-for-women\n    - https://opengameart.org/content/lpc-pirates\n    - https://opengameart.org/content/lpc-santa\n\n- legs/pantaloons/male/sky.png: by Nila122, Johannes Sjölund (wulax), Stephen Challener (Redshrike). License(s): OGA-BY 3.0, CC-BY-SA 3.0,, GPL 2.0, GPL 3.0. \n    - https://opengameart.org/content/lpc-pirates\n    - https://opengameart.org/content/more-lpc-clothes-and-hair\n\n- feet/shoes/male/leather.png: by bluecarrot16, Johannes Sjölund (wulax). License(s): OGA-BY 3.0, CC-BY-SA 3.0, GPL 3.0. \n    - https://opengameart.org/content/lpc-medieval-fantasy-character-sprites\n    - http://opengameart.org/content/lpc-clothing-updates\n\n- weapon/ranged/slingshot/foreground/slingshot.png: by bluecarrot16. License(s): OGA-BY 3.0+, GPL 3.0, CC-BY 4.0. \n    - https://opengameart.org/content/lpc-more-weapons\n\n- weapon/ranged/slingshot/background/slingshot.png: by bluecarrot16. License(s): OGA-BY 3.0+, GPL 3.0, CC-BY 4.0. \n    - https://opengameart.org/content/lpc-more-weapons",
    "layers": [
      {
        "fileName": "weapon/ranged/slingshot/background/slingshot.png",
        "zPos": 9,
        "parentName": "weapon",
        "name": "Slingshot",
        "variant": "slingshot"
      },
      {
        "fileName": "body/bodies/male/light.png",
        "zPos": 10,
        "parentName": "body",
        "name": "Body color",
        "variant": "light"
      },
      {
        "fileName": "feet/shoes/male/leather.png",
        "zPos": 15,
        "parentName": "shoes",
        "name": "Shoes",
        "variant": "leather"
      },
      {
        "fileName": "legs/pantaloons/male/sky.png",
        "zPos": 20,
        "parentName": "legs",
        "name": "Pantaloons",
        "variant": "sky"
      },
      {
        "fileName": "torso/clothes/sleeveless/striped/male/tan.png",
        "zPos": 35,
        "parentName": "clothes",
        "name": "Sleeveless striped",
        "variant": "tan"
      },
      {
        "fileName": "torso/waist/belt_belly/male/tan.png",
        "zPos": 70,
        "parentName": "belt",
        "name": "Belly belt",
        "variant": "tan"
      },
      {
        "fileName": "head/heads/human/male/light.png",
        "zPos": 100,
        "parentName": "head",
        "name": "Human male",
        "variant": "light"
      },
      {
        "fileName": "eyes/human/adult/gray.png",
        "zPos": 105,
        "parentName": "eyes",
        "name": "Eyes",
        "variant": "gray"
      },
      {
        "fileName": "hat/cloth/male/bandana_red.png",
        "zPos": 130,
        "parentName": "hat",
        "name": "Cloth",
        "variant": "bandana red"
      },
      {
        "fileName": "weapon/ranged/slingshot/foreground/slingshot.png",
        "zPos": 140,
        "parentName": "weapon",
        "name": "Slingshot",
        "variant": "slingshot"
      }
    ]
  }